{
  "$schema": "https://json-schema.org/draft/2020-12/schema",
  "$id": "https://github.com/49g-holding/49GAION-protocol/spec/schemas/signature.schema.json",
  "title": "49GAION Operating Protocol - signature record",
  "description": "The record of one signature of a human position for an action of a listed decision type, made by the position itself or by its own Chief of Staff under a grant the position signed (Protocol §4.10, items 6, 7 and 9; Standard §4.4, items 6 and 8; 49GAION/DR-0053). It holds only the payload hash, Cell codes, times and the sign-in evidence; no person's identity and no reference to one (Standard §1.1, item 9; 49GAION/DR-0049). This schema proves shape only; behaviour (replay, revocation, expiry, wrong executor, altered payload, revoked credential, signer Cell retired or stopped) is tested in the tests of each [ORG]AION's gateway.",
  "type": "object",
  "required": [
    "signature_id",
    "decision_type",
    "target_code",
    "payload_hash",
    "signer_cell",
    "signer_seat_kind",
    "signer_credential",
    "executor_cell",
    "work_item_id",
    "nonce",
    "issued_at",
    "expires_at",
    "sign_in_evidence"
  ],
  "additionalProperties": false,
  "properties": {
    "signature_id": {
      "type": "string",
      "pattern": "^SIG-[0-9A-Za-z-]+$",
      "description": "The signature ID recorded in the unit register."
    },
    "decision_type": {
      "type": "string",
      "pattern": "^[a-z][a-z0-9-]+$",
      "description": "A type ID of the signature list."
    },
    "target_code": {
      "type": "string",
      "description": "The code of the part the action is on."
    },
    "payload_hash": {
      "type": "string",
      "pattern": "^sha256:[0-9a-f]{64}$",
      "description": "Hash of the canonical action payload; the gateway runs the call only when its hash equals this."
    },
    "signer_cell": {
      "type": "string",
      "pattern": "^(\\[ORG\\]|[0-9A-Za-z]+)CELL-[A-Z0-9]{2,8}$",
      "description": "The code of the human Cell the signature is given for: the position whose decision it is, also where its Chief of Staff signed for it."
    },
    "signer_seat_kind": {
      "const": "human",
      "description": "The signer's Cell is a human seat. A signature for an AI Cell, an attached assistant included, is never valid; a position's own Chief of Staff signs for that position, under signer_cell, never for itself (Protocol §4.10, items 6 and 7)."
    },
    "signer_role": {
      "$comment": "RULE-NO-ACTING-OR-DEPUTY: acting fillers and deputies are the organisation's own mechanism (49GAION/DR-0049)",
      "description": "Withdrawn by 49GAION/DR-0049. The signer is the position, under its own Cell code; whether a position has an acting holder or a deputy is the organisation's own mechanism, outside the system. A record that carries this field is refused.",
      "not": {}
    },
    "delegation_ref": {
      "$comment": "RULE-NO-ACTING-OR-DEPUTY: acting fillers and deputies are the organisation's own mechanism (49GAION/DR-0049)",
      "description": "Withdrawn by 49GAION/DR-0049, with signer_role. Delegation between positions is read from the signing Cell's authority_scope (Standard §4.4, item 8). A record that carries this field is refused.",
      "not": {}
    },
    "signer_identity_ref": {
      "$comment": "RULE-NO-PERSON-REFERENCE: no person's identity, and no reference to one, in the system (49GAION/DR-0049)",
      "description": "Withdrawn by 49GAION/DR-0049. The system records no person's identity and no reference to one; any record of who stood behind a signature is the organisation's own, outside the system (Standard §1.1, item 9). A record that carries this field is refused.",
      "not": {}
    },
    "signer_credential": {
      "type": "object",
      "description": "The credential the organisation's mechanism issued for the signing position, used with a fresh live sign-in (Standard §1.1, item 9; HF-10); or, for a signature by the position's own Chief of Staff, its credential under a grant the position signed with such a sign-in (Protocol §4.10, items 6 and 10). Never another AI credential or a technical key.",
      "required": [
        "kind",
        "authenticator"
      ],
      "additionalProperties": false,
      "properties": {
        "kind": {
          "enum": [
            "human-live-sign-in",
            "chief-of-staff-under-grant"
          ],
          "description": "human-live-sign-in: the position signed itself. chief-of-staff-under-grant: its own Chief of Staff signed under its grant (under_grant). Never another AI credential or a technical key."
        },
        "authenticator": {
          "const": "phishing-resistant",
          "description": "The sign-in the position made: at signing, or, for a signature under a grant, when it signed the grant."
        },
        "bound_to_one_person": {
          "$comment": "RULE-NO-PERSON-REFERENCE: the gateway verifies the credential for the position, never the person (49GAION/DR-0049)",
          "description": "Withdrawn by 49GAION/DR-0049: how the organisation issues its credentials is its own mechanism, outside the system. A record that carries this field is refused.",
          "not": {}
        }
      }
    },
    "under_grant": {
      "type": "object",
      "description": "For a signature by the position's own Chief of Staff: the grant it signed under, which the position signed with a fresh live sign-in and the gateway recorded, and the Chief of Staff's Cell. The gateway runs the action only while that grant is in force and reaches its type, and never with the Chief of Staff as the executor (Protocol §4.10, items 6, 9 and 11).",
      "required": [
        "grant_ref",
        "chief_of_staff_cell"
      ],
      "additionalProperties": false,
      "properties": {
        "grant_ref": {
          "type": "string",
          "pattern": "^EV-[0-9A-Za-z-]+$",
          "description": "The event ID of the grant in the record at the gateway (Protocol §24, item 9)."
        },
        "chief_of_staff_cell": {
          "type": "string",
          "pattern": "^(\\[ORG\\]|[0-9A-Za-z]+)CELL-[A-Z0-9]{2,8}$",
          "description": "The code of the position's own Chief of Staff Cell, which signed."
        }
      }
    },
    "executor_cell": {
      "type": "string",
      "pattern": "^(\\[ORG\\]|[0-9A-Za-z]+)CELL-[A-Z0-9]{2,8}$",
      "description": "The Cell that may run the signed action; the gateway checks the caller is this Cell."
    },
    "work_item_id": {
      "type": "string"
    },
    "nonce": {
      "type": "string",
      "minLength": 16,
      "description": "Single-use; the gateway refuses a nonce already used."
    },
    "issued_at": {
      "type": "string",
      "format": "date-time"
    },
    "expires_at": {
      "type": "string",
      "format": "date-time"
    },
    "sign_in_evidence": {
      "type": "object",
      "required": [
        "signed_in_at",
        "session_ref"
      ],
      "additionalProperties": false,
      "properties": {
        "signed_in_at": {
          "type": "string",
          "format": "date-time"
        },
        "session_ref": {
          "type": "string",
          "description": "The reference of the sign-in event at the organisation's mechanism, as evidence of the fresh live sign-in; it carries no person's identity."
        }
      },
      "description": "Evidence of the fresh live sign-in (HF-10): made at signing, or, for a signature under a grant, made when the position signed the grant."
    },
    "revoked": {
      "type": "boolean"
    }
  },
  "allOf": [
    {
      "$comment": "RULE-COS-UNDER-GRANT: a Chief of Staff signs only under its position's grant, and a position's own signature names no grant (49GAION/DR-0053)",
      "if": {
        "properties": {
          "signer_credential": {
            "properties": {
              "kind": {
                "const": "chief-of-staff-under-grant"
              }
            },
            "required": [
              "kind"
            ]
          }
        },
        "required": [
          "signer_credential"
        ]
      },
      "then": {
        "required": [
          "under_grant"
        ]
      },
      "else": {
        "not": {
          "required": [
            "under_grant"
          ]
        }
      }
    }
  ]
}
