{
  "signature_id": "SIG-0001",
  "decision_type": "sign-contract",
  "target_code": "TenAIOC-SL",
  "payload_hash": "sha256:abababababababababababababababababababababababababababababababab",
  "signer_cell": "TenCELL-TMS",
  "signer_seat_kind": "human",
  "signer_credential": {
    "kind": "human-live-sign-in",
    "authenticator": "phishing-resistant"
  },
  "executor_cell": "TenCELL-SLCS",
  "work_item_id": "WI-0042",
  "nonce": "n-6c1f0e2b9a7d4c3e",
  "issued_at": "2026-10-13T09:00:00Z",
  "expires_at": "2026-10-13T10:00:00Z",
  "sign_in_evidence": {
    "signed_in_at": "2026-10-13T08:59:30Z",
    "session_ref": "sess-91"
  }
}
